{"root_collection": "Procedural Buildings", "source_collection": "Buildings", "include_selected_only": false, "replace_existing": true, "enable_building_parts": true, "skip_parent_footprints_with_parts": true, "inherit_parent_tags_for_parts": true, "building_part_match_tolerance": 0.25, "use_mesh_instancing": true, "batch_generated_meshes": true, "batch_roles": ["window", "window_frame", "window_mullion", "window_sill", "ledge", "balcony", "balcony_rail", "balcony_bar", "door_frame", "door_handle", "door_canopy", "roof_edge", "roof_lamp", "antenna", "antenna_panel", "signboard", "awning", "garage_door", "loading_dock", "stair_core", "shutter", "facade_ornament", "panel_seam", "insulation_band", "roof_tile", "roof_window", "dormer", "chimney", "gutter", "pv_panel", "hvac_unit", "roof_plant"], "default_levels": 5, "default_floor_height": 3.1, "irregular_floor_heights": {"0": 4.1}, "excluded_building_values": ["shelter"], "styles": [{"name": "gruenderzeit_residential", "building_values": [], "tag_filters": {}, "default_levels": null, "default_floor_height": null, "roof": null, "wall_material": "Grammar Stucco Sandstone", "wall_color": [0.72, 0.64, 0.5, 1.0], "wall_texture_path": null, "wall_texture_scale": 1.0, "wall_color_variants": [], "wall_color_variant_mode": "none", "wall_row_colors": [], "wall_row_color_mode": "cycle", "window": {"width": 1.05, "height": 1.85, "sill_height": 0.75, "spacing": 2.25, "min_margin": 0.65, "depth": 0.08, "material": "Grammar Tall Altbau Glass", "color": [0.13, 0.21, 0.25, 1.0], "texture_path": null, "texture_scale": 1.0, "frame_width": 0.11, "frame_depth": 0.05, "frame_material": "Grammar Painted Altbau Frames", "frame_color": [0.9, 0.86, 0.76, 1.0], "vertical_mullions": 1, "horizontal_mullions": 1, "sill_depth": 0.28, "sill_thickness": 0.08, "sill_material": "Grammar Sandstone Window Sills", "sill_color": [0.82, 0.76, 0.64, 1.0]}, "ledge": {"enabled": true, "depth": 0.22, "height": 0.1, "every_n_floors": 1, "material": "Grammar Stucco Cornices", "color": [0.82, 0.76, 0.64, 1.0], "texture_path": null, "texture_scale": 1.0}, "balcony": {"enabled": true, "width": 1.7, "depth": 0.55, "slab_height": 0.1, "railing_height": 0.95, "every_n_floors": 2, "material": "Grammar Gruenderzeit Ironwork", "color": [0.035, 0.03, 0.025, 1.0], "texture_path": null, "texture_scale": 1.0, "railing_material": "Grammar Ornate Iron Railings", "railing_color": [0.025, 0.022, 0.02, 1.0], "railing_bar_count": 7, "railing_bar_width": 0.035, "railing_bar_depth": 0.035}, "door": {"enabled": true, "placement": "first_facade", "width": 1.25, "height": 2.35, "depth": 0.09, "material": "Grammar Altbau Timber Door", "color": [0.16, 0.075, 0.035, 1.0], "texture_path": null, "texture_scale": 1.0, "frame_width": 0.13, "frame_depth": 0.05, "frame_material": "Grammar Sandstone Door Portal", "frame_color": [0.82, 0.76, 0.64, 1.0], "handle_enabled": true, "handle_radius": 0.045, "handle_material": "Grammar Door Handles", "handle_color": [0.84, 0.68, 0.32, 1.0], "canopy_enabled": false, "canopy_width": 1.9, "canopy_depth": 0.7, "canopy_thickness": 0.08, "canopy_material": "Grammar Residential Door Canopy", "canopy_color": [0.36, 0.36, 0.34, 1.0]}, "antenna": {"enabled": true, "type": "tv", "count": 1, "mast_height": 1.25, "mast_radius": 0.025, "base_width": 0.28, "base_depth": 0.28, "base_height": 0.12, "panel_width": 0.45, "panel_height": 0.18, "panel_depth": 0.035, "material": "Grammar Domestic Antenna Metal", "color": [0.32, 0.32, 0.31, 1.0], "accent_material": "Grammar Domestic Antenna Elements", "accent_color": [0.74, 0.74, 0.68, 1.0]}}, {"name": "jugendstil_residential", "building_values": [], "tag_filters": {}, "default_levels": null, "default_floor_height": null, "roof": null, "wall_material": "Grammar Jugendstil Plaster", "wall_color": [0.78, 0.7, 0.58, 1.0], "wall_texture_path": null, "wall_texture_scale": 1.0, "wall_color_variants": [[0.78, 0.7, 0.58, 1.0], [0.72, 0.66, 0.56, 1.0], [0.82, 0.76, 0.64, 1.0]], "wall_color_variant_mode": "building", "wall_row_colors": [], "wall_row_color_mode": "cycle", "window": {"width": 1.18, "height": 1.75, "sill_height": 0.82, "spacing": 2.45, "min_margin": 0.7, "depth": 0.075, "material": "Grammar Jugendstil Glass", "color": [0.12, 0.2, 0.24, 1.0], "texture_path": null, "texture_scale": 1.0, "frame_width": 0.1, "frame_depth": 0.05, "frame_material": "Grammar Jugendstil Painted Frames", "frame_color": [0.88, 0.84, 0.76, 1.0], "vertical_mullions": 1, "horizontal_mullions": 2, "sill_depth": 0.24, "sill_thickness": 0.08, "sill_material": "Grammar Jugendstil Stone Sills", "sill_color": [0.8, 0.74, 0.64, 1.0]}, "ledge": {"enabled": true, "depth": 0.2, "height": 0.09, "every_n_floors": 1, "material": "Grammar Jugendstil Floral Bands", "color": [0.84, 0.78, 0.68, 1.0], "texture_path": null, "texture_scale": 1.0}, "balcony": {"enabled": true, "width": 1.85, "depth": 0.58, "slab_height": 0.1, "railing_height": 0.9, "every_n_floors": 2, "material": "Grammar Jugendstil Balcony Slabs", "color": [0.72, 0.66, 0.56, 1.0], "texture_path": null, "texture_scale": 1.0, "railing_material": "Grammar Curved Iron Balcony Railings", "railing_color": [0.035, 0.032, 0.028, 1.0], "railing_bar_count": 8, "railing_bar_width": 0.03, "railing_bar_depth": 0.03}, "door": {"enabled": true, "placement": "first_facade", "width": 1.55, "height": 2.65, "depth": 0.1, "material": "Grammar Jugendstil Carved Timber Door", "color": [0.18, 0.075, 0.035, 1.0], "texture_path": null, "texture_scale": 1.0, "frame_width": 0.18, "frame_depth": 0.06, "frame_material": "Grammar Jugendstil Portal Stone", "frame_color": [0.84, 0.78, 0.66, 1.0], "handle_enabled": true, "handle_radius": 0.05, "handle_material": "Grammar Brass Door Handles", "handle_color": [0.82, 0.64, 0.28, 1.0], "canopy_enabled": false, "canopy_width": 1.8, "canopy_depth": 0.75, "canopy_thickness": 0.08, "canopy_material": "Grammar Door Canopies", "canopy_color": [0.36, 0.36, 0.34, 1.0]}, "antenna": {"enabled": true, "type": "lightning_rod", "count": 1, "mast_height": 1.9, "mast_radius": 0.018, "base_width": 0.18, "base_depth": 0.18, "base_height": 0.08, "panel_width": 0.12, "panel_height": 0.35, "panel_depth": 0.02, "material": "Grammar Lightning Rod Steel", "color": [0.42, 0.42, 0.39, 1.0], "accent_material": "Grammar Lightning Rod Tip", "accent_color": [0.76, 0.74, 0.66, 1.0]}}, {"name": "fachwerk_townhouse", "building_values": [], "tag_filters": {}, "default_levels": null, "default_floor_height": null, "roof": null, "wall_material": "Grammar Fachwerk Infill", "wall_color": [0.86, 0.82, 0.7, 1.0], "wall_texture_path": null, "wall_texture_scale": 1.0, "wall_color_variants": [], "wall_color_variant_mode": "none", "wall_row_colors": [[0.48, 0.32, 0.18, 1.0], [0.86, 0.82, 0.7, 1.0]], "wall_row_color_mode": "ground_accent", "window": {"width": 0.92, "height": 1.15, "sill_height": 0.95, "spacing": 2.1, "min_margin": 0.7, "depth": 0.06, "material": "Grammar Small Timber Window Glass", "color": [0.13, 0.22, 0.24, 1.0], "texture_path": null, "texture_scale": 1.0, "frame_width": 0.095, "frame_depth": 0.045, "frame_material": "Grammar Dark Timber Window Frames", "frame_color": [0.16, 0.09, 0.045, 1.0], "vertical_mullions": 1, "horizontal_mullions": 1, "sill_depth": 0.13, "sill_thickness": 0.05, "sill_material": "Grammar Timber Window Sills", "sill_color": [0.2, 0.12, 0.06, 1.0]}, "ledge": {"enabled": true, "depth": 0.09, "height": 0.06, "every_n_floors": 1, "material": "Grammar Fachwerk Floor Beams", "color": [0.18, 0.1, 0.05, 1.0], "texture_path": null, "texture_scale": 1.0}, "balcony": {"enabled": false, "width": 1.9, "depth": 0.75, "slab_height": 0.12, "railing_height": 0.9, "every_n_floors": 2, "material": "Grammar Balconies", "color": [0.58, 0.58, 0.55, 1.0], "texture_path": null, "texture_scale": 1.0, "railing_material": "Grammar Balcony Railings", "railing_color": [0.16, 0.16, 0.15, 1.0], "railing_bar_count": 5, "railing_bar_width": 0.04, "railing_bar_depth": 0.04}, "door": {"enabled": true, "placement": "first_facade", "width": 1.15, "height": 2.05, "depth": 0.1, "material": "Grammar Fachwerk Timber Door", "color": [0.14, 0.075, 0.035, 1.0], "texture_path": null, "texture_scale": 1.0, "frame_width": 0.14, "frame_depth": 0.06, "frame_material": "Grammar Fachwerk Door Beams", "frame_color": [0.18, 0.1, 0.05, 1.0], "handle_enabled": true, "handle_radius": 0.04, "handle_material": "Grammar Iron Latch Handles", "handle_color": [0.05, 0.045, 0.04, 1.0], "canopy_enabled": true, "canopy_width": 1.55, "canopy_depth": 0.58, "canopy_thickness": 0.08, "canopy_material": "Grammar Fachwerk Small Canopy", "canopy_color": [0.24, 0.13, 0.06, 1.0]}, "antenna": {"enabled": true, "type": "satellite", "count": 1, "mast_height": 0.75, "mast_radius": 0.025, "base_width": 0.32, "base_depth": 0.32, "base_height": 0.12, "panel_width": 0.55, "panel_height": 0.55, "panel_depth": 0.05, "material": "Grammar Satellite Mount Metal", "color": [0.3, 0.3, 0.29, 1.0], "accent_material": "Grammar Pale Satellite Dish", "accent_color": [0.82, 0.82, 0.76, 1.0]}}, {"name": "bauhaus_residential", "building_values": [], "tag_filters": {}, "default_levels": null, "default_floor_height": null, "roof": null, "wall_material": "Grammar Bauhaus White Render", "wall_color": [0.9, 0.89, 0.84, 1.0], "wall_texture_path": null, "wall_texture_scale": 1.0, "wall_color_variants": [], "wall_color_variant_mode": "none", "wall_row_colors": [], "wall_row_color_mode": "cycle", "window": {"width": 1.95, "height": 1.15, "sill_height": 1.05, "spacing": 2.35, "min_margin": 0.55, "depth": 0.035, "material": "Grammar Bauhaus Dark Frames", "color": [0.08, 0.1, 0.11, 1.0], "texture_path": null, "texture_scale": 1.0, "frame_width": 0.06, "frame_depth": 0.035, "frame_material": "Grammar Bauhaus Steel Frames", "frame_color": [0.06, 0.065, 0.065, 1.0], "vertical_mullions": 2, "horizontal_mullions": 0, "sill_depth": 0.1, "sill_thickness": 0.04, "sill_material": "Grammar Bauhaus Thin Sills", "sill_color": [0.72, 0.72, 0.68, 1.0]}, "ledg